{
  "decision": {
    "authority_basis": "operator-selected authoritative supervisor",
    "big_task_id": null,
    "candidate_sha": "aaaaaaaaaaaaaaaaaaaaaaaaaaaaaaaaaaaaaaaa",
    "conditions": [
      "publish exact candidate SHA"
    ],
    "decided_at": "2099-01-01T00:00:00Z",
    "decision": "AUTHORIZE_PUBLICATION",
    "decision_id": "decision-publication-1",
    "decision_type": "PUBLICATION_AUTHORIZATION",
    "facts": [
      "review and full integrated validation passed"
    ],
    "facts_digest": null,
    "remaining_risk": [],
    "run_id": "example-run",
    "schema_version": "2.1",
    "supervisor_profile": "mlgo-supervisor"
  },
  "decision_digest": "63ea693f9d770307c595bde137b4a31085b177d8cf8b1d889479a0df1bfcb20d",
  "decision_id": "decision-publication-1",
  "provenance": {
    "adapter": "mlgo_cao_v2.provider_rollout.v1",
    "artifact_path": "/tmp/rollout.jsonl",
    "artifact_record_index": 13,
    "artifact_record_sha256": "aaaaaaaaaaaaaaaaaaaaaaaaaaaaaaaaaaaaaaaaaaaaaaaaaaaaaaaaaaaaaaaa",
    "artifact_sha256": "ffffffffffffffffffffffffffffffffffffffffffffffffffffffffffffffff",
    "captured_at": "2099-01-01T00:00:01Z",
    "delivery_id": "delivery-example-1",
    "observation_source": "provider_rollout",
    "observation_trust": "HOST_PARSED_PROVIDER_ARTIFACT",
    "observed_message_id": "native:message-example-2",
    "provider": "codex",
    "provider_session_id": "session-example-1",
    "response_text_sha256": "dddddddddddddddddddddddddddddddddddddddddddddddddddddddddddddddd",
    "supervisor_generation": 1,
    "supervisor_profile": "mlgo-supervisor",
    "terminal_id": "terminal-example-1"
  },
  "record_type": "HOST_CAPTURED_SUPERVISOR_DECISION",
  "run_id": "example-run",
  "schema_version": "1.0"
}
